{
  "contract": "change.lease",
  "version": 1,
  "repository_id_sha256": "aaaaaaaaaaaaaaaaaaaaaaaaaaaaaaaaaaaaaaaaaaaaaaaaaaaaaaaaaaaaaaaa",
  "change_id": "CHG-2026-0002",
  "workspace_id_sha256": "bbbbbbbbbbbbbbbbbbbbbbbbbbbbbbbbbbbbbbbbbbbbbbbbbbbbbbbbbbbbbbbb",
  "holder_id_sha256": "cccccccccccccccccccccccccccccccccccccccccccccccccccccccccccccccc",
  "fencing_token": 1,
  "acquired_at": "2026-08-31T00:00:00+00:00",
  "expires_at": "2026-08-31T00:05:00+00:00",
  "state": "ACTIVE"
}
